{"claims":[{"evidence_refs":["ev-hohmann-dataset","ev-hohmann-baseline-code"],"falsification_checks":["dimensional-consistency","fixed-holdout-rmse","candidate-set-replay"],"holdout_verified":true,"level":"validated-reproduction","status":"reproduced","text":"Within the committed analytic Hohmann fixture, the bounded candidate tof-hohmann-v1 passes the dimensional and fixed holdout gates."}],"code_revision":"local-working-tree","created_at":"2026-09-21T10:28:30.540835Z","environment":{"implementation":"CPython","machine":"AMD64","network":"disabled","packages":{"auditable-scientist-lab":"0.1.0","pydantic":"2.11.10","sympy":"1.13.3"},"python":"3.12.3","system":"Windows"},"events":[{"event_id":"d3064f73-9b66-4297-a270-0cbbc179e76f","event_type":"run.initialized","occurred_at":"2026-09-21T10:28:30.540835Z","payload":{"input_hash":"7a65020acaf83cfc24586395b74f3db51e8eba73acf2ae7798e5577647f3f481","run_id":"run-7a65020acaf83cfc"},"payload_hash":"dae0735f3cc4aeb6edc5da434891d08c2e928d61382136dba022ca8611791775","prev_event_hash":"genesis","seq":0},{"event_id":"2ca11b6f-e146-4987-aa9d-01f4e4392572","event_type":"policy.applied","occurred_at":"2026-09-21T10:28:30.548982Z","payload":{"allowed_provider":"internal-bounded-generator","max_seconds":60.0,"max_tool_calls":1,"network":"disabled","policy_id":"offline-hohmann-v1"},"payload_hash":"d78f3fb66eb4898ba65c6bd3603a7c4da8b92b0e2be680f443bb6a6ab8a6a0e4","prev_event_hash":"dae0735f3cc4aeb6edc5da434891d08c2e928d61382136dba022ca8611791775","seq":1},{"event_id":"650869a7-d9ad-4044-b1c8-0db08721522c","event_type":"tool.invoked","occurred_at":"2026-09-21T10:28:30.556519Z","payload":{"calls_used":1,"tool_id":"hohmann-benchmark"},"payload_hash":"56e8c1abe5e0d05dae1df78ee0cd608305d0cc737af373d7dca54fa6c2eaba0d","prev_event_hash":"d78f3fb66eb4898ba65c6bd3603a7c4da8b92b0e2be680f443bb6a6ab8a6a0e4","seq":2},{"event_id":"539f08b9-e10d-4910-ae48-db896cf3961e","event_type":"candidate_set.committed","occurred_at":"2026-09-21T10:28:30.564143Z","payload":{"candidate_order":["tof-hohmann-v1","tof-missing-pi-v1","tof-radius-sum-v1","tof-inner-orbit-v1","tof-outer-orbit-v1"],"candidate_set_hash":"a99ed081f76b29cbf8a14255b2cae3181cdac59d225e28765842464bdfac4b85"},"payload_hash":"0367638bc7599ea90d45b068bb01a3c4e99a3f96bc68c80d0b7f88619c7ff2ff","prev_event_hash":"56e8c1abe5e0d05dae1df78ee0cd608305d0cc737af373d7dca54fa6c2eaba0d","seq":3},{"event_id":"ac8d399d-90cf-4268-bb02-cf2079ff5c21","event_type":"holdout.evaluated","occurred_at":"2026-09-21T10:28:30.572183Z","payload":{"gate":{"holdout":{"count":3,"mae":2.0842586915629605e-13,"max_abs_error":4.263256414560601e-13,"residuals":[1.4210854715202004e-13,-5.684341886080802e-14,4.263256414560601e-13],"rmse":2.6152091439906184e-13},"passed":true,"reason":"holdout RMSE is within threshold","threshold":1e-08,"train":{"count":6,"mae":2.6053233644537005e-13,"max_abs_error":3.979039320256561e-13,"residuals":[3.979039320256561e-13,-2.8421709430404007e-13,-2.5579538487363607e-13,-5.684341886080802e-14,2.2737367544323206e-13,-3.410605131648481e-13],"rmse":2.8159971914385265e-13}},"selected_candidate_id":"tof-hohmann-v1"},"payload_hash":"86fb1225ec88572d0e0a04f6a78af148ba2b344f98ddb582e8ce9dce1c525de3","prev_event_hash":"0367638bc7599ea90d45b068bb01a3c4e99a3f96bc68c80d0b7f88619c7ff2ff","seq":4},{"event_id":"fb1e36ff-3914-4ec1-94db-dece3201aced","event_type":"run.completed","occurred_at":"2026-09-21T10:28:30.580622Z","payload":{"claim_status":"reproduced","status":"completed"},"payload_hash":"5c472c601d8e7b6300b2a89f73c25cadd90f1713848570f32ba28a59af3fe251","prev_event_hash":"86fb1225ec88572d0e0a04f6a78af148ba2b344f98ddb582e8ce9dce1c525de3","seq":5}],"evidence":[{"allowed_use":["offline-demo","fixture"],"evidence_id":"ev-hohmann-dataset","kind":"data","notes":"Local source or fixture; replay verifies bytes but does not establish external licensing or real-data status.","path_or_uri":"E:\\xuexi\\auditable-scientist-lab\\examples\\hohmann\\dataset.json","provenance_status":"unverified","sha256":"58484830a36617896cd1f8a2df645092b2e94048427c05a7c041ed39ccba0213","source_revision":"local-working-tree"},{"allowed_use":["analytic-reference","offline-demo"],"evidence_id":"ev-hohmann-baseline-code","kind":"code","notes":"Local source or fixture; replay verifies bytes but does not establish external licensing or real-data status.","path_or_uri":"E:\\xuexi\\auditable-scientist-lab\\src\\auditable_scientist\\tools\\numerical.py","provenance_status":"unverified","sha256":"c8bd3bf6258b4c5eb3c3555c58dabd4e0d1e9d9cc373a8486a50424a152b4150","source_revision":"local-working-tree"}],"evidence_refs":["ev-hohmann-dataset","ev-hohmann-baseline-code"],"input_hash":"7a65020acaf83cfc24586395b74f3db51e8eba73acf2ae7798e5577647f3f481","observations":[{"dataset_hash":"31df2f8c355f1e68dda1af6fc53848609f3f256bbe63adcde0d2abbf22c2af63","observation_id":"obs-train","source_ref":"E:\\xuexi\\auditable-scientist-lab\\examples\\hohmann\\dataset.json","split":"train","summary":{"case_ids":["train-01","train-02","train-03","train-04","train-05","train-06"],"count":6,"target":"time_of_flight_days"},"units":{"mu_km3_s2":"km^3/s^2","r1_km":"km","r2_km":"km","target":"day"}},{"dataset_hash":"31df2f8c355f1e68dda1af6fc53848609f3f256bbe63adcde0d2abbf22c2af63","observation_id":"obs-holdout","source_ref":"E:\\xuexi\\auditable-scientist-lab\\examples\\hohmann\\dataset.json","split":"holdout","summary":{"case_ids":["holdout-01","holdout-02","holdout-03"],"count":3,"target":"time_of_flight_days"},"units":{"mu_km3_s2":"km^3/s^2","r1_km":"km","r2_km":"km","target":"day"}}],"run_id":"run-7a65020acaf83cfc","seed":17,"status":"completed","task_id":"hohmann-time-of-flight-v1","traces":[{"entries":[{"event_type":"run.initialized","payload_hash":"dae0735f3cc4aeb6edc5da434891d08c2e928d61382136dba022ca8611791775","seq":0},{"event_type":"policy.applied","payload_hash":"d78f3fb66eb4898ba65c6bd3603a7c4da8b92b0e2be680f443bb6a6ab8a6a0e4","seq":1},{"event_type":"tool.invoked","payload_hash":"56e8c1abe5e0d05dae1df78ee0cd608305d0cc737af373d7dca54fa6c2eaba0d","seq":2},{"event_type":"candidate_set.committed","payload_hash":"0367638bc7599ea90d45b068bb01a3c4e99a3f96bc68c80d0b7f88619c7ff2ff","seq":3},{"event_type":"holdout.evaluated","payload_hash":"86fb1225ec88572d0e0a04f6a78af148ba2b344f98ddb582e8ce9dce1c525de3","seq":4},{"event_type":"run.completed","payload_hash":"5c472c601d8e7b6300b2a89f73c25cadd90f1713848570f32ba28a59af3fe251","seq":5}],"input_hash":"7a65020acaf83cfc24586395b74f3db51e8eba73acf2ae7798e5577647f3f481","run_id":"run-7a65020acaf83cfc","trace_id":"trace-run-7a65020acaf83cfc"}]}
