{"agent":{"agent_id":"offline-t2-agent-v1","capabilities":["invoke-registered-evaluator","record-negative-case"],"name":"Offline T2 evaluator agent","version":"1"},"claims":[{"evidence_refs":["ev-t2-fixture","ev-t2-evaluator-code"],"falsification_checks":["positive-evaluator-replay","negative-case-rejection","fixture-hash"],"holdout_verified":false,"level":"validated-reproduction","status":"unverified","text":"The T2 evaluator passed its bounded fixture gate; this is not a real-world scientific claim."}],"code_revision":"local-working-tree","created_at":"2026-09-21T00:00:00Z","environment":{"implementation":"CPython","machine":"AMD64","mode":"offline","network":"disabled","packages":{"auditable-scientist-lab":"0.1.0","jsonschema":"4.24.0","pydantic":"2.11.10","sympy":"1.13.3"},"python":"3.12.3","runtime":"bounded-evaluator","system":"Windows","track_id":"T2"},"evaluators":[{"evaluator_id":"causal-intervention-v1","name":"T2 independent evaluator","read_only":true,"version":"1"}],"events":[{"event_id":"t2-event-0","event_type":"run.initialized","occurred_at":"2026-09-21T00:00:00Z","payload":{"input_hash":"e8c0533775f1ab69ceaecfd9de3933012a4f961d6df6df4653ac85f20b6c97b9","run_id":"run-t2-e8c0533775f1ab69"},"payload_hash":"4bdd73e00a1195ee7c0f561f991641de0b247063b850b755903034c46c5a5057","prev_event_hash":"genesis","seq":0},{"event_id":"t2-event-1","event_type":"policy.applied","occurred_at":"2026-09-21T00:00:01Z","payload":{"network":"disabled","policy_id":"offline-t2-v1","provider_id":"internal-t2-evaluator"},"payload_hash":"d4e8c6c5a1d58c0573b070b63108b3fffe04dcbcf54a7bd5858060bfc29ebad6","prev_event_hash":"4bdd73e00a1195ee7c0f561f991641de0b247063b850b755903034c46c5a5057","seq":1},{"event_id":"t2-event-2","event_type":"tool.invoked","occurred_at":"2026-09-21T00:00:02Z","payload":{"calls_used":1,"tool_id":"t2-evaluator"},"payload_hash":"04a3882ece068c331625197330921b4acd3218d630fc6019539c56cdc6005864","prev_event_hash":"d4e8c6c5a1d58c0573b070b63108b3fffe04dcbcf54a7bd5858060bfc29ebad6","seq":2},{"event_id":"t2-event-3","event_type":"evaluator.completed","occurred_at":"2026-09-21T00:00:03Z","payload":{"evaluator_id":"causal-intervention-v1","result":{"coefficient":2.0,"evaluator_id":"causal-intervention-v1","holdout_rmse":0.0,"intercept":1.0,"max_context_invariance_error":0.0,"negative_candidate_rejected":true,"notes":["Intervention outcome uses do(x=value); context_value is intentionally ignored.","Negative candidate is required to fail the holdout gate."],"passed":true,"train_rmse":0.0}},"payload_hash":"64b829986cd6e4c2c5775aaed59cb03c3a47f811945273a053de94e651fe0523","prev_event_hash":"04a3882ece068c331625197330921b4acd3218d630fc6019539c56cdc6005864","seq":3},{"event_id":"t2-event-4","event_type":"negative_case.checked","occurred_at":"2026-09-21T00:00:04Z","payload":{"negative_case":{"rejected":true,"wrong_coefficient":1.0},"negative_case_passed":true},"payload_hash":"95ce69bc49d016e58884d599e9bf1d4c9e55323d509564ecea5f70b3fbf03076","prev_event_hash":"64b829986cd6e4c2c5775aaed59cb03c3a47f811945273a053de94e651fe0523","seq":4},{"event_id":"t2-event-5","event_type":"run.completed","occurred_at":"2026-09-21T00:00:05Z","payload":{"status":"completed"},"payload_hash":"d0765f73cd5d1df39be353d538ea7c47a017d66a8bd001dc4707240dbb71e58c","prev_event_hash":"95ce69bc49d016e58884d599e9bf1d4c9e55323d509564ecea5f70b3fbf03076","seq":5}],"evidence":[{"allowed_use":["offline-fixture","bounded-evaluator"],"evidence_id":"ev-t2-fixture","kind":"data","notes":"Fixture evidence is not real-data or publication evidence.","path_or_uri":"E:\\xuexi\\auditable-scientist-lab\\examples\\causal\\fixture.json","provenance_status":"unverified","sha256":"71564d14c5ed40133f1f1c89e0597afb4fd48a350905e6e2efd94ed47a46f292","source_revision":"local-working-tree"},{"allowed_use":["offline-evaluator","source-provenance"],"evidence_id":"ev-t2-evaluator-code","kind":"code","notes":"Local evaluator source fingerprint; this does not establish external scientific validity.","path_or_uri":"E:\\xuexi\\auditable-scientist-lab\\src\\auditable_scientist\\tracks\\causal.py","provenance_status":"unverified","sha256":"f35d397499777edfab301198824daa9066c8b1f6a18eb10faceba82520c6acb4","source_revision":"local-working-tree"}],"evidence_refs":["ev-t2-fixture","ev-t2-evaluator-code"],"input_hash":"e8c0533775f1ab69ceaecfd9de3933012a4f961d6df6df4653ac85f20b6c97b9","memories":[{"content_hash":"dc82def315d527881b863b6a3b34f7b268db87ace460baa5efd572c613978639","memory_id":"evidence-policy-memory-v1","scope":"claim-level evidence boundaries","source_ref":"E:\\xuexi\\auditable-scientist-lab\\docs\\EVIDENCE_POLICY.md","version":"local-snapshot"}],"observations":[{"dataset_hash":"e8c0533775f1ab69ceaecfd9de3933012a4f961d6df6df4653ac85f20b6c97b9","observation_id":"obs-t2-fixture","source_ref":"E:\\xuexi\\auditable-scientist-lab\\examples\\causal\\fixture.json","split":"external","summary":{"evaluator_id":"causal-intervention-v1","evidence_level":"validated-reproduction","track_id":"T2"},"units":{}}],"policy":{"allowed_paths":["E:\\xuexi\\auditable-scientist-lab\\examples\\causal"],"allowed_providers":["internal-t2-evaluator"],"max_seconds":60.0,"max_tool_calls":1,"network":"disabled","policy_id":"offline-t2-v1"},"providers":[{"kind":"deterministic-domain-evaluator","name":"Internal T2 evaluator","provider_id":"internal-t2-evaluator","source_ref":"src/auditable_scientist/tracks","version":"1"}],"run_id":"run-t2-e8c0533775f1ab69","seed":17,"status":"completed","task_id":"t2-causal-intervention-v1","tools":[{"deterministic":true,"name":"T2 domain evaluator","network_required":false,"parameter_schema_ref":"schemas/track-tool-call-v1.json","tool_id":"t2-evaluator","version":"1"}],"traces":[{"entries":[{"event_type":"run.initialized","payload_hash":"4bdd73e00a1195ee7c0f561f991641de0b247063b850b755903034c46c5a5057","seq":0},{"event_type":"policy.applied","payload_hash":"d4e8c6c5a1d58c0573b070b63108b3fffe04dcbcf54a7bd5858060bfc29ebad6","seq":1},{"event_type":"tool.invoked","payload_hash":"04a3882ece068c331625197330921b4acd3218d630fc6019539c56cdc6005864","seq":2},{"event_type":"evaluator.completed","payload_hash":"64b829986cd6e4c2c5775aaed59cb03c3a47f811945273a053de94e651fe0523","seq":3},{"event_type":"negative_case.checked","payload_hash":"95ce69bc49d016e58884d599e9bf1d4c9e55323d509564ecea5f70b3fbf03076","seq":4},{"event_type":"run.completed","payload_hash":"d0765f73cd5d1df39be353d538ea7c47a017d66a8bd001dc4707240dbb71e58c","seq":5}],"input_hash":"e8c0533775f1ab69ceaecfd9de3933012a4f961d6df6df4653ac85f20b6c97b9","run_id":"run-t2-e8c0533775f1ab69","trace_id":"trace-run-t2-e8c0533775f1ab69"}]}
