{"agent":{"agent_id":"offline-t5-pbs-source-agent-v1","capabilities":["invoke-read-only-source-audit","record-human-review-block"],"name":"Offline T5 document evidence agent","version":"1"},"claims":[{"evidence_refs":["ev-t5p-source-audit","ev-t5p-source-contract","ev-t5p-tool-code","ev-t5p-verifier-code","ev-t5p-method"],"falsification_checks":["source-hash-and-license","page-citation-inventory","branch-and-safety-flags","read-only-policy","human-biosafety-review-required"],"holdout_verified":false,"level":"demo","status":"unverified","text":"The cited PBS document is an independently validated and safe executable protocol."}],"code_revision":"local-working-tree","created_at":"2026-09-28T00:00:00Z","environment":{"implementation":"CPython","machine":"AMD64","mode":"offline","network":"disabled","packages":{"auditable-scientist-lab":"0.1.0","jsonschema":"4.24.0","pydantic":"2.11.10"},"provider_id":"internal-t5-pbs-source-audit-v1","python":"3.12.3","runtime":"optional-read-only-real-source-inventory","system":"Windows","track_id":"T5"},"evaluators":[{"evaluator_id":"t5-pbs-source-inventory-v1","name":"T5 real-source citation-inventory evaluator","read_only":true,"version":"1"}],"events":[{"event_id":"t5-pbs-event-0","event_type":"run.initialized","occurred_at":"2026-09-28T00:00:00Z","payload":{"input_hash":"06a7e9fae2d1864211e7bdc64762499b7aba1e43d8ce3fb2226ad093403bd7b0","run_id":"run-t5-pbs-source-06a7e9fae2d18642"},"payload_hash":"8a2c916dcabc384f9cefe08cb152d7b004e4ddde49ae1ac3debb10efc3a17714","prev_event_hash":"genesis","seq":0},{"event_id":"t5-pbs-event-1","event_type":"policy.applied","occurred_at":"2026-09-28T00:00:01Z","payload":{"network":"disabled","policy_id":"offline-t5-pbs-source-inventory-v1","provider_id":"internal-t5-pbs-source-audit-v1"},"payload_hash":"604fa92978dba46d4f33920dab64fef7e87fc0be427df6e9828bc6d821ee237f","prev_event_hash":"8a2c916dcabc384f9cefe08cb152d7b004e4ddde49ae1ac3debb10efc3a17714","seq":1},{"event_id":"t5-pbs-event-2","event_type":"tool.invoked","occurred_at":"2026-09-28T00:00:02Z","payload":{"calls_used":1,"tool_id":"t5-read-only-pbs-source-audit-v1"},"payload_hash":"54a839b71fab3a924c982c6c665c3c4ea1a0f999125df61b6dfb4c8106bbea16","prev_event_hash":"604fa92978dba46d4f33920dab64fef7e87fc0be427df6e9828bc6d821ee237f","seq":2},{"event_id":"t5-pbs-event-3","event_type":"evaluator.completed","occurred_at":"2026-09-28T00:00:03Z","payload":{"anchor_count":11,"evaluator_id":"t5-pbs-source-inventory-v1","page_count":3,"step_count":6},"payload_hash":"4d7d73082bfc88ab5355d11a358fb99e14ed8f56f373893c423b1eb9a7da91ce","prev_event_hash":"54a839b71fab3a924c982c6c665c3c4ea1a0f999125df61b6dfb4c8106bbea16","seq":3},{"event_id":"t5-pbs-event-4","event_type":"review.required","occurred_at":"2026-09-28T00:00:04Z","payload":{"execution_allowed":false,"safety_flags":["self-reported-working-is-not-independent-validation","concentration-and-ph-branches-require-selection","sds-review-required-by-source","optional-depc-requires-expert-safety-review","acid-and-autoclave-require-expert-safety-review","not-mappable-to-teaching-fixture-fields-without-inference"]},"payload_hash":"e3af03d5cfde8087dc02a992f9c9a47466729adb9e543685616bb7d9654c9837","prev_event_hash":"4d7d73082bfc88ab5355d11a358fb99e14ed8f56f373893c423b1eb9a7da91ce","seq":4},{"event_id":"t5-pbs-event-5","event_type":"run.completed","occurred_at":"2026-09-28T00:00:05Z","payload":{"status":"completed"},"payload_hash":"d0765f73cd5d1df39be353d538ea7c47a017d66a8bd001dc4707240dbb71e58c","prev_event_hash":"e3af03d5cfde8087dc02a992f9c9a47466729adb9e543685616bb7d9654c9837","seq":5}],"evidence":[{"allowed_use":["source-inventory","citation-only"],"evidence_id":"ev-t5p-source-audit","kind":"snapshot","notes":"Real rights-declared PDF source inventory only; no protocol execution, biosafety clearance, or scientific validation.","path_or_uri":"run://source-audit-snapshot.json","provenance_status":"unverified","sha256":"3fac4711333cbe3e433c7a5d097ffc07b28bffe23cb1c2b7892738f79216c11f","source_revision":"local-working-tree"},{"allowed_use":["rights-declaration","scope-boundary"],"evidence_id":"ev-t5p-source-contract","kind":"snapshot","notes":"Real rights-declared PDF source inventory only; no protocol execution, biosafety clearance, or scientific validation.","path_or_uri":"root://docs/T5_PBS_SOURCE_CONTRACT.json","provenance_status":"unverified","sha256":"5d1537b3afcf92b617b46bab47549558ab198fde437568387f0b3db70d4e5b61","source_revision":"local-working-tree"},{"allowed_use":["offline-tool","source-provenance"],"evidence_id":"ev-t5p-tool-code","kind":"code","notes":"Real rights-declared PDF source inventory only; no protocol execution, biosafety clearance, or scientific validation.","path_or_uri":"root://scripts/verify_t5_pbs_source_run.py","provenance_status":"unverified","sha256":"a9a401a630c3573a5354c72816fa9752550b46e9eb998a151cddb85d98a6d78f","source_revision":"local-working-tree"},{"allowed_use":["source-provenance"],"evidence_id":"ev-t5p-verifier-code","kind":"code","notes":"Real rights-declared PDF source inventory only; no protocol execution, biosafety clearance, or scientific validation.","path_or_uri":"root://scripts/verify_t5_pbs_source.py","provenance_status":"unverified","sha256":"4cdf836a8b5141563392ef8122a224f3947ff9fee4c44c01e9b8019483cfb16f","source_revision":"local-working-tree"},{"allowed_use":["method-and-boundaries"],"evidence_id":"ev-t5p-method","kind":"snapshot","notes":"Real rights-declared PDF source inventory only; no protocol execution, biosafety clearance, or scientific validation.","path_or_uri":"root://docs/T5_PBS_SOURCE_RESULT.md","provenance_status":"unverified","sha256":"9c5283639943b2773617ee930a693e96b4a81c1a51fdf9799e7b872f1f58eb5b","source_revision":"local-working-tree"}],"evidence_refs":["ev-t5p-source-audit","ev-t5p-source-contract","ev-t5p-tool-code","ev-t5p-verifier-code","ev-t5p-method"],"input_hash":"06a7e9fae2d1864211e7bdc64762499b7aba1e43d8ce3fb2226ad093403bd7b0","memories":[{"content_hash":"dc82def315d527881b863b6a3b34f7b268db87ace460baa5efd572c613978639","memory_id":"evidence-policy-memory-v1","scope":"claim-level evidence boundaries","source_ref":"root://docs/EVIDENCE_POLICY.md","version":"local-snapshot"}],"observations":[{"dataset_hash":"184b4d211aa8c1a2fcde0eb06a2fd8ae57727c28f1a2b41e5fbfd94b5f8c1271","observation_id":"obs-t5-pbs-source-inventory","source_ref":"run://source-audit-snapshot.json","split":"external","summary":{"anchor_count":11,"execution_allowed":false,"page_count":3,"scope":"rights-declared-document-only","step_count":6},"units":{}}],"policy":{"allowed_paths":["root://scripts/verify_t5_pbs_source_run.py","root://scripts/verify_t5_pbs_source.py","root://scripts/verify_acceptance.py","root://src/auditable_scientist/domain/models.py","root://src/auditable_scientist/policy/runtime.py","root://src/auditable_scientist/runtime/canonical.py","root://src/auditable_scientist/runtime/environment.py","root://src/auditable_scientist/runtime/event_log.py","root://src/auditable_scientist/runtime/replay.py","root://src/auditable_scientist/runtime/run_integrity.py","root://src/auditable_scientist/runtime/paths.py","root://artifacts/t5-pbs-source-audit.json","root://docs/T5_PBS_SOURCE_CONTRACT.json","root://docs/T5_PBS_SOURCE_RESULT.md","root://docs/EVIDENCE_POLICY.md","root://docs/contracts/t5-pbs-source-tool-call-v1.json","root://requirements-t5-pbs-pdf.txt","run://source-audit-snapshot.json"],"allowed_providers":["internal-t5-pbs-source-audit-v1"],"max_seconds":60.0,"max_tool_calls":1,"network":"disabled","policy_id":"offline-t5-pbs-source-inventory-v1"},"providers":[{"kind":"deterministic-domain-evaluator","name":"Local read-only source inventory","provider_id":"internal-t5-pbs-source-audit-v1","source_ref":"scripts/verify_t5_pbs_source.py","version":"1"}],"run_id":"run-t5-pbs-source-06a7e9fae2d18642","seed":17,"status":"completed","task_id":"t5-optional-pbs-source-review-v1","tools":[{"deterministic":true,"name":"Read-only protocol source and citation audit","network_required":false,"parameter_schema_ref":"docs/contracts/t5-pbs-source-tool-call-v1.json","tool_id":"t5-read-only-pbs-source-audit-v1","version":"1"}],"traces":[{"entries":[{"event_type":"run.initialized","payload_hash":"8a2c916dcabc384f9cefe08cb152d7b004e4ddde49ae1ac3debb10efc3a17714","seq":0},{"event_type":"policy.applied","payload_hash":"604fa92978dba46d4f33920dab64fef7e87fc0be427df6e9828bc6d821ee237f","seq":1},{"event_type":"tool.invoked","payload_hash":"54a839b71fab3a924c982c6c665c3c4ea1a0f999125df61b6dfb4c8106bbea16","seq":2},{"event_type":"evaluator.completed","payload_hash":"4d7d73082bfc88ab5355d11a358fb99e14ed8f56f373893c423b1eb9a7da91ce","seq":3},{"event_type":"review.required","payload_hash":"e3af03d5cfde8087dc02a992f9c9a47466729adb9e543685616bb7d9654c9837","seq":4},{"event_type":"run.completed","payload_hash":"d0765f73cd5d1df39be353d538ea7c47a017d66a8bd001dc4707240dbb71e58c","seq":5}],"input_hash":"06a7e9fae2d1864211e7bdc64762499b7aba1e43d8ce3fb2226ad093403bd7b0","run_id":"run-t5-pbs-source-06a7e9fae2d18642","trace_id":"trace-run-t5-pbs-source-06a7e9fae2d18642"}]}
