{"agent":{"agent_id":"offline-t5-agent-v1","capabilities":["invoke-registered-evaluator","record-negative-case"],"name":"Offline T5 evaluator agent","version":"1"},"claims":[{"evidence_refs":["ev-t5-fixture","ev-t5-evaluator-code"],"falsification_checks":["positive-evaluator-replay","negative-case-rejection","fixture-hash"],"holdout_verified":false,"level":"validated-reproduction","status":"unverified","text":"The T5 evaluator passed its bounded fixture gate; this is not a real-world scientific claim."}],"code_revision":"local-working-tree","created_at":"2026-09-21T00:00:00Z","environment":{"implementation":"CPython","machine":"AMD64","mode":"offline","network":"disabled","packages":{"auditable-scientist-lab":"0.1.0","jsonschema":"4.24.0","pydantic":"2.11.10","sympy":"1.13.3"},"python":"3.12.3","runtime":"bounded-evaluator","system":"Windows","track_id":"T5"},"evaluators":[{"evaluator_id":"bio-chem-protocol-v1","name":"T5 independent evaluator","read_only":true,"version":"1"}],"events":[{"event_id":"t5-event-0","event_type":"run.initialized","occurred_at":"2026-09-21T00:00:00Z","payload":{"input_hash":"cc6170f111df81a8fb62b3440a8525540af1a4a4f745dedf367ff451537f2a13","run_id":"run-t5-cc6170f111df81a8"},"payload_hash":"10c45f988b9fbb3a29216ec544333f77fe60befc821e44a697742e3363a2a87a","prev_event_hash":"genesis","seq":0},{"event_id":"t5-event-1","event_type":"policy.applied","occurred_at":"2026-09-21T00:00:01Z","payload":{"network":"disabled","policy_id":"offline-t5-v1","provider_id":"internal-t5-evaluator"},"payload_hash":"f986c79cd1601f24cd5330262efabe4e18e5dacbb00dbaff152ef1dacc39eb55","prev_event_hash":"10c45f988b9fbb3a29216ec544333f77fe60befc821e44a697742e3363a2a87a","seq":1},{"event_id":"t5-event-2","event_type":"tool.invoked","occurred_at":"2026-09-21T00:00:02Z","payload":{"calls_used":1,"tool_id":"t5-evaluator"},"payload_hash":"9afb4472b3cc47ec956289106762074194ac82859e121826a4084abbf619a023","prev_event_hash":"f986c79cd1601f24cd5330262efabe4e18e5dacbb00dbaff152ef1dacc39eb55","seq":2},{"event_id":"t5-event-3","event_type":"evaluator.completed","occurred_at":"2026-09-21T00:00:03Z","payload":{"evaluator_id":"bio-chem-protocol-v1","result":{"evaluator_id":"bio-chem-protocol-v1","evidence_level":"validated-reproduction","execution_allowed":false,"failures":[],"notes":["This evaluator checks declarative constraints only.","It never schedules, controls, or authorizes wet-lab execution."],"passed":true}},"payload_hash":"483538484b76c0715ca4e8a1768bb4763b2d99ada6edc4238c37d15f965412d6","prev_event_hash":"9afb4472b3cc47ec956289106762074194ac82859e121826a4084abbf619a023","seq":3},{"event_id":"t5-event-4","event_type":"negative_case.checked","occurred_at":"2026-09-21T00:00:04Z","payload":{"negative_case":{"evaluator_id":"bio-chem-protocol-v1","evidence_level":"demo","execution_allowed":false,"failures":["provenance:step-1"],"notes":["This evaluator checks declarative constraints only.","It never schedules, controls, or authorizes wet-lab execution."],"passed":false},"negative_case_passed":true},"payload_hash":"273c75ffcf218fb9a1cabf6217a7caca3c548e6a15612980dabd7b11e3c165da","prev_event_hash":"483538484b76c0715ca4e8a1768bb4763b2d99ada6edc4238c37d15f965412d6","seq":4},{"event_id":"t5-event-5","event_type":"run.completed","occurred_at":"2026-09-21T00:00:05Z","payload":{"status":"completed"},"payload_hash":"d0765f73cd5d1df39be353d538ea7c47a017d66a8bd001dc4707240dbb71e58c","prev_event_hash":"273c75ffcf218fb9a1cabf6217a7caca3c548e6a15612980dabd7b11e3c165da","seq":5}],"evidence":[{"allowed_use":["offline-fixture","bounded-evaluator"],"evidence_id":"ev-t5-fixture","kind":"data","notes":"Fixture evidence is not real-data or publication evidence.","path_or_uri":"run://fixture.json","provenance_status":"unverified","sha256":"63a646290b28f1da3a081c07db662c232cfb6313b6b476e38d9bbe273874d91e","source_revision":"local-working-tree"},{"allowed_use":["offline-evaluator","source-provenance"],"evidence_id":"ev-t5-evaluator-code","kind":"code","notes":"Local evaluator source fingerprint; this does not establish external scientific validity.","path_or_uri":"root://src/auditable_scientist/tracks/protocol.py","provenance_status":"unverified","sha256":"f365b7d61ec903383aaa3e3464ffd4dc0a459f8b4eb6fe83b44ea07fd21e5c41","source_revision":"local-working-tree"}],"evidence_refs":["ev-t5-fixture","ev-t5-evaluator-code"],"input_hash":"cc6170f111df81a8fb62b3440a8525540af1a4a4f745dedf367ff451537f2a13","memories":[{"content_hash":"dc82def315d527881b863b6a3b34f7b268db87ace460baa5efd572c613978639","memory_id":"evidence-policy-memory-v1","scope":"claim-level evidence boundaries","source_ref":"root://docs/EVIDENCE_POLICY.md","version":"local-snapshot"}],"observations":[{"dataset_hash":"cc6170f111df81a8fb62b3440a8525540af1a4a4f745dedf367ff451537f2a13","observation_id":"obs-t5-fixture","source_ref":"run://fixture.json","split":"external","summary":{"evaluator_id":"bio-chem-protocol-v1","evidence_level":"validated-reproduction","track_id":"T5"},"units":{}}],"policy":{"allowed_paths":["run://fixture.json"],"allowed_providers":["internal-t5-evaluator"],"max_seconds":60.0,"max_tool_calls":1,"network":"disabled","policy_id":"offline-t5-v1"},"providers":[{"kind":"deterministic-domain-evaluator","name":"Internal T5 evaluator","provider_id":"internal-t5-evaluator","source_ref":"src/auditable_scientist/tracks","version":"1"}],"run_id":"run-t5-cc6170f111df81a8","seed":17,"status":"completed","task_id":"t5-bio-chem-protocol-v1","tools":[{"deterministic":true,"name":"T5 domain evaluator","network_required":false,"parameter_schema_ref":"schemas/track-tool-call-v1.json","tool_id":"t5-evaluator","version":"1"}],"traces":[{"entries":[{"event_type":"run.initialized","payload_hash":"10c45f988b9fbb3a29216ec544333f77fe60befc821e44a697742e3363a2a87a","seq":0},{"event_type":"policy.applied","payload_hash":"f986c79cd1601f24cd5330262efabe4e18e5dacbb00dbaff152ef1dacc39eb55","seq":1},{"event_type":"tool.invoked","payload_hash":"9afb4472b3cc47ec956289106762074194ac82859e121826a4084abbf619a023","seq":2},{"event_type":"evaluator.completed","payload_hash":"483538484b76c0715ca4e8a1768bb4763b2d99ada6edc4238c37d15f965412d6","seq":3},{"event_type":"negative_case.checked","payload_hash":"273c75ffcf218fb9a1cabf6217a7caca3c548e6a15612980dabd7b11e3c165da","seq":4},{"event_type":"run.completed","payload_hash":"d0765f73cd5d1df39be353d538ea7c47a017d66a8bd001dc4707240dbb71e58c","seq":5}],"input_hash":"cc6170f111df81a8fb62b3440a8525540af1a4a4f745dedf367ff451537f2a13","run_id":"run-t5-cc6170f111df81a8","trace_id":"trace-run-t5-cc6170f111df81a8"}]}
