{"agent":{"agent_id":"offline-t3-agent-v1","capabilities":["invoke-registered-evaluator","record-negative-case"],"name":"Offline T3 evaluator agent","version":"1"},"claims":[{"evidence_refs":["ev-t3-fixture","ev-t3-evaluator-code","ev-t3-rk4-reference-code"],"falsification_checks":["positive-evaluator-replay","negative-case-rejection","fixture-hash","rk4-backend-agreement"],"holdout_verified":false,"level":"validated-reproduction","status":"unverified","text":"The T3 evaluator passed its bounded fixture gate; this is not a real-world scientific claim."}],"code_revision":"local-working-tree","created_at":"2026-09-21T00:00:00Z","environment":{"implementation":"CPython","machine":"AMD64","mode":"offline","network":"disabled","packages":{"auditable-scientist-lab":"0.1.0","jsonschema":"4.24.0","pydantic":"2.11.10","sympy":"1.13.3"},"python":"3.12.3","runtime":"bounded-evaluator","system":"Windows","track_id":"T3"},"evaluators":[{"evaluator_id":"harmonic-dynamics-v2","name":"T3 independent evaluator","read_only":true,"version":"1"}],"events":[{"event_id":"t3-event-0","event_type":"run.initialized","occurred_at":"2026-09-21T00:00:00Z","payload":{"input_hash":"1c4eb6b86751563709009d6f51af52d67422de512a8279b1cb552b58d56f5f86","run_id":"run-t3-1c4eb6b867515637"},"payload_hash":"2256ccf2279f5d9d09bfca1e9f42d7875717661c7b7ddbf40059882062304e72","prev_event_hash":"genesis","seq":0},{"event_id":"t3-event-1","event_type":"policy.applied","occurred_at":"2026-09-21T00:00:01Z","payload":{"network":"disabled","policy_id":"offline-t3-v1","provider_id":"internal-t3-evaluator"},"payload_hash":"3791d3e321da5c979d9294b9071580278c30958c49ee231a93982644609f99a8","prev_event_hash":"2256ccf2279f5d9d09bfca1e9f42d7875717661c7b7ddbf40059882062304e72","seq":1},{"event_id":"t3-event-2","event_type":"tool.invoked","occurred_at":"2026-09-21T00:00:02Z","payload":{"calls_used":1,"tool_id":"t3-evaluator"},"payload_hash":"46ff62df2c446655a150256e678edcb0bda9f3cd7883963041dc653d7280479b","prev_event_hash":"3791d3e321da5c979d9294b9071580278c30958c49ee231a93982644609f99a8","seq":2},{"event_id":"t3-event-3","event_type":"evaluator.completed","occurred_at":"2026-09-21T00:00:03Z","payload":{"evaluator_id":"harmonic-dynamics-v2","result":{"backend_agreement_passed":true,"evaluator_id":"harmonic-dynamics-v2","holdout_max_position_error":1.0495796261222878e-05,"max_backend_position_delta":1.9978152767885504e-05,"max_energy_drift":1.2499992203318655e-05,"max_reference_energy_drift":1.3855472325019491e-11,"max_reference_position_error":4.824394772562357e-10,"negative_euler_rejected":true,"notes":["Velocity-Verlet and independently implemented fixed-step RK4 are compared with the closed-form harmonic solution.","Explicit Euler is a required negative control for conservation drift.","The RK4 method citation is a reference, not an imported software or data dependency."],"passed":true,"reference_solver_id":"fixed-step-rk4-v1","solver_id":"velocity-verlet-v1","train_max_position_error":1.9977752245103897e-05}},"payload_hash":"eecf436a89f89457079c2b9aa51752602a4cd83233e19cea3e73dd6c0b3633f9","prev_event_hash":"46ff62df2c446655a150256e678edcb0bda9f3cd7883963041dc653d7280479b","seq":3},{"event_id":"t3-event-4","event_type":"negative_case.checked","occurred_at":"2026-09-21T00:00:04Z","payload":{"negative_case":{"rejected":true,"solver":"explicit-euler"},"negative_case_passed":true},"payload_hash":"7c6ad6482f87d1a564831078a3299cacca51dc601d5ac16730a92bb8d6674d74","prev_event_hash":"eecf436a89f89457079c2b9aa51752602a4cd83233e19cea3e73dd6c0b3633f9","seq":4},{"event_id":"t3-event-5","event_type":"run.completed","occurred_at":"2026-09-21T00:00:05Z","payload":{"status":"completed"},"payload_hash":"d0765f73cd5d1df39be353d538ea7c47a017d66a8bd001dc4707240dbb71e58c","prev_event_hash":"7c6ad6482f87d1a564831078a3299cacca51dc601d5ac16730a92bb8d6674d74","seq":5}],"evidence":[{"allowed_use":["offline-fixture","bounded-evaluator"],"evidence_id":"ev-t3-fixture","kind":"data","notes":"Fixture evidence is not real-data or publication evidence.","path_or_uri":"E:\\xuexi\\auditable-scientist-lab\\examples\\dynamics\\fixture.json","provenance_status":"unverified","sha256":"1e28db56d300c42755fd6614c2137abc34f21caf9b2e22ff3026d47f7d0ccd37","source_revision":"local-working-tree"},{"allowed_use":["offline-evaluator","source-provenance"],"evidence_id":"ev-t3-evaluator-code","kind":"code","notes":"Local evaluator source fingerprint; this does not establish external scientific validity.","path_or_uri":"E:\\xuexi\\auditable-scientist-lab\\src\\auditable_scientist\\tracks\\dynamics.py","provenance_status":"unverified","sha256":"bcaf80f6b87fe03a64fdaaab8c3cf05d7f73a3eaf18fd1af80c1b010b161ef5b","source_revision":"local-working-tree"},{"allowed_use":["offline-evaluator","source-provenance"],"evidence_id":"ev-t3-rk4-reference-code","kind":"code","notes":"Local independent numerical method; academic formula citation does not establish source rights or real-world validation.","path_or_uri":"E:\\xuexi\\auditable-scientist-lab\\src\\auditable_scientist\\tracks\\reference_rk4.py","provenance_status":"unverified","sha256":"12d2956df65294126940dba22e56daa3b7c484d4dc4ca232404b1bf14d152792","source_revision":"local-working-tree"}],"evidence_refs":["ev-t3-fixture","ev-t3-evaluator-code","ev-t3-rk4-reference-code"],"input_hash":"1c4eb6b86751563709009d6f51af52d67422de512a8279b1cb552b58d56f5f86","memories":[{"content_hash":"dc82def315d527881b863b6a3b34f7b268db87ace460baa5efd572c613978639","memory_id":"evidence-policy-memory-v1","scope":"claim-level evidence boundaries","source_ref":"E:\\xuexi\\auditable-scientist-lab\\docs\\EVIDENCE_POLICY.md","version":"local-snapshot"}],"observations":[{"dataset_hash":"1c4eb6b86751563709009d6f51af52d67422de512a8279b1cb552b58d56f5f86","observation_id":"obs-t3-fixture","source_ref":"E:\\xuexi\\auditable-scientist-lab\\examples\\dynamics\\fixture.json","split":"external","summary":{"evaluator_id":"harmonic-dynamics-v2","evidence_level":"validated-reproduction","track_id":"T3"},"units":{}}],"policy":{"allowed_paths":["E:\\xuexi\\auditable-scientist-lab\\examples\\dynamics"],"allowed_providers":["internal-t3-evaluator"],"max_seconds":60.0,"max_tool_calls":1,"network":"disabled","policy_id":"offline-t3-v1"},"providers":[{"kind":"deterministic-domain-evaluator","name":"Internal T3 evaluator","provider_id":"internal-t3-evaluator","source_ref":"src/auditable_scientist/tracks","version":"1"}],"run_id":"run-t3-1c4eb6b867515637","seed":17,"status":"completed","task_id":"t3-harmonic-dynamics-v1","tools":[{"deterministic":true,"name":"T3 domain evaluator","network_required":false,"parameter_schema_ref":"schemas/track-tool-call-v1.json","tool_id":"t3-evaluator","version":"1"}],"traces":[{"entries":[{"event_type":"run.initialized","payload_hash":"2256ccf2279f5d9d09bfca1e9f42d7875717661c7b7ddbf40059882062304e72","seq":0},{"event_type":"policy.applied","payload_hash":"3791d3e321da5c979d9294b9071580278c30958c49ee231a93982644609f99a8","seq":1},{"event_type":"tool.invoked","payload_hash":"46ff62df2c446655a150256e678edcb0bda9f3cd7883963041dc653d7280479b","seq":2},{"event_type":"evaluator.completed","payload_hash":"eecf436a89f89457079c2b9aa51752602a4cd83233e19cea3e73dd6c0b3633f9","seq":3},{"event_type":"negative_case.checked","payload_hash":"7c6ad6482f87d1a564831078a3299cacca51dc601d5ac16730a92bb8d6674d74","seq":4},{"event_type":"run.completed","payload_hash":"d0765f73cd5d1df39be353d538ea7c47a017d66a8bd001dc4707240dbb71e58c","seq":5}],"input_hash":"1c4eb6b86751563709009d6f51af52d67422de512a8279b1cb552b58d56f5f86","run_id":"run-t3-1c4eb6b867515637","trace_id":"trace-run-t3-1c4eb6b867515637"}]}
