{"agent":{"agent_id":"offline-t4-linear-agent-v1","capabilities":["invoke-registered-proof","record-negative-control"],"name":"Offline T4 exact proof agent","version":"1"},"claims":[{"evidence_refs":["ev-t4l-input","ev-t4l-static-certificate","ev-t4l-tool-code","ev-t4l-independent-checker","ev-t4l-method"],"falsification_checks":["exact-coefficient-identities","independent-fraction-checker","leaky-negative-control","source-and-snapshot-binding"],"holdout_verified":false,"level":"demo","status":"unverified","text":"The declared linear transition represents a physically conserved quantity."}],"code_revision":"local-working-tree","created_at":"2026-09-27T00:00:00Z","environment":{"implementation":"CPython","machine":"AMD64","mode":"offline","network":"disabled","packages":{"auditable-scientist-lab":"0.1.0","jsonschema":"4.24.0","pydantic":"2.11.10","sympy":"1.13.3"},"provider_id":"internal-sympy-t4-linear-v1","python":"3.12.3","runtime":"optional-exact-linear-proof","system":"Windows","track_id":"T4"},"evaluators":[{"evaluator_id":"t4-exact-linear-invariant-class-v1","name":"T4 exact rational linear-invariant evaluator","read_only":true,"version":"1"}],"events":[{"event_id":"t4-linear-event-0","event_type":"run.initialized","occurred_at":"2026-09-27T00:00:00Z","payload":{"input_hash":"6931db19a01bc59b2e8ef66773e6f16c374f6785457c39f25fae01d9168ef18c","run_id":"run-t4-linear-6931db19a01bc59b"},"payload_hash":"70bc8035141439803937ac09073665eb21a3cda9c172d8cfbe047b915e2ed817","prev_event_hash":"genesis","seq":0},{"event_id":"t4-linear-event-1","event_type":"policy.applied","occurred_at":"2026-09-27T00:00:01Z","payload":{"network":"disabled","policy_id":"offline-t4-exact-linear-v1","provider_id":"internal-sympy-t4-linear-v1"},"payload_hash":"1d32a62d546a01836c2506bd7a4e7bf42e5346c5da74d4137a6897b64ec886f2","prev_event_hash":"70bc8035141439803937ac09073665eb21a3cda9c172d8cfbe047b915e2ed817","seq":1},{"event_id":"t4-linear-event-2","event_type":"tool.invoked","occurred_at":"2026-09-27T00:00:02Z","payload":{"calls_used":1,"tool_id":"t4-exact-linear-invariant-v1"},"payload_hash":"75b5568f6b035c4061144c6db6c5d64636933532db8e7136bb0942b6e492cd45","prev_event_hash":"1d32a62d546a01836c2506bd7a4e7bf42e5346c5da74d4137a6897b64ec886f2","seq":2},{"event_id":"t4-linear-event-3","event_type":"evaluator.completed","occurred_at":"2026-09-27T00:00:03Z","payload":{"evaluator_id":"t4-exact-linear-invariant-class-v1","summary":{"negative_controls":1,"positive_proofs":2,"systems":3,"verified":true}},"payload_hash":"37db195fc55c9ab263a5ac67cd6c1c3cdd7b9d3404b70e35060524cdd8e4838f","prev_event_hash":"75b5568f6b035c4061144c6db6c5d64636933532db8e7136bb0942b6e492cd45","seq":3},{"event_id":"t4-linear-event-4","event_type":"negative_case.checked","occurred_at":"2026-09-27T00:00:04Z","payload":{"leaky_system_rejected":true},"payload_hash":"c951e32c30835cc5ee00067d0181bd33aa321a07f9155db815ed781bee523bff","prev_event_hash":"37db195fc55c9ab263a5ac67cd6c1c3cdd7b9d3404b70e35060524cdd8e4838f","seq":4},{"event_id":"t4-linear-event-5","event_type":"run.completed","occurred_at":"2026-09-27T00:00:05Z","payload":{"status":"completed"},"payload_hash":"d0765f73cd5d1df39be353d538ea7c47a017d66a8bd001dc4707240dbb71e58c","prev_event_hash":"c951e32c30835cc5ee00067d0181bd33aa321a07f9155db815ed781bee523bff","seq":5}],"evidence":[{"allowed_use":["declared-matrix-fixture"],"evidence_id":"ev-t4l-input","kind":"data","notes":"Exact algebra on declared matrices; physical model, data rights, and publication status remain unverified.","path_or_uri":"run://fixture.json","provenance_status":"unverified","sha256":"91c95ca1b557eff6a016e956b5de54d0aaf9ca51110de26cb86a28796277dfe1","source_revision":"local-working-tree"},{"allowed_use":["exact-certificate","source-provenance"],"evidence_id":"ev-t4l-static-certificate","kind":"snapshot","notes":"Exact algebra on declared matrices; physical model, data rights, and publication status remain unverified.","path_or_uri":"root://artifacts/t4-linear-formal-audit.json","provenance_status":"unverified","sha256":"7dbea15518efe325fb8d05cfa77d0170cc50e55ca3882ec40affef7c51f4d8b1","source_revision":"local-working-tree"},{"allowed_use":["offline-tool","source-provenance"],"evidence_id":"ev-t4l-tool-code","kind":"code","notes":"Exact algebra on declared matrices; physical model, data rights, and publication status remain unverified.","path_or_uri":"root://scripts/verify_t4_linear_run.py","provenance_status":"unverified","sha256":"56003cfbfb7e241cd5b88e7aefc0b24ef4e777e814e88167da7c141f5eee57d4","source_revision":"local-working-tree"},{"allowed_use":["independent-checker"],"evidence_id":"ev-t4l-independent-checker","kind":"code","notes":"Exact algebra on declared matrices; physical model, data rights, and publication status remain unverified.","path_or_uri":"root://scripts/check_t4_linear_certificate.py","provenance_status":"unverified","sha256":"37aa7721518fe634ac9ee75ad68954f77c2122a0190173dc13acc0984fa29d62","source_revision":"local-working-tree"},{"allowed_use":["method-and-boundaries"],"evidence_id":"ev-t4l-method","kind":"snapshot","notes":"Exact algebra on declared matrices; physical model, data rights, and publication status remain unverified.","path_or_uri":"root://docs/T4_LINEAR_INVARIANTS.md","provenance_status":"unverified","sha256":"889c6b1c120e379af2d882e1f9558895b8c4126188ad69a6afe02f7b608552b5","source_revision":"local-working-tree"}],"evidence_refs":["ev-t4l-input","ev-t4l-static-certificate","ev-t4l-tool-code","ev-t4l-independent-checker","ev-t4l-method"],"input_hash":"6931db19a01bc59b2e8ef66773e6f16c374f6785457c39f25fae01d9168ef18c","memories":[{"content_hash":"dc82def315d527881b863b6a3b34f7b268db87ace460baa5efd572c613978639","memory_id":"evidence-policy-memory-v1","scope":"claim-level evidence boundaries","source_ref":"root://docs/EVIDENCE_POLICY.md","version":"local-snapshot"}],"observations":[{"dataset_hash":"6931db19a01bc59b2e8ef66773e6f16c374f6785457c39f25fae01d9168ef18c","observation_id":"obs-t4-linear-certificates","source_ref":"run://fixture.json","split":"external","summary":{"negative_controls":1,"positive_proofs":2,"scope":"declared-rational-linear-systems","systems":3,"verified":true},"units":{}}],"policy":{"allowed_paths":["root://scripts/verify_t4_linear_run.py","root://scripts/verify_t4_linear_formal.py","root://scripts/check_t4_linear_certificate.py","root://src/auditable_scientist/tracks/proof.py","root://src/auditable_scientist/domain/models.py","root://src/auditable_scientist/policy/runtime.py","root://src/auditable_scientist/runtime/canonical.py","root://src/auditable_scientist/runtime/environment.py","root://src/auditable_scientist/runtime/event_log.py","root://src/auditable_scientist/runtime/replay.py","root://src/auditable_scientist/runtime/run_integrity.py","root://src/auditable_scientist/runtime/paths.py","root://artifacts/t4-linear-systems-input.json","root://artifacts/t4-linear-formal-audit.json","root://docs/T4_LINEAR_INVARIANTS.md","root://docs/EVIDENCE_POLICY.md","root://schemas/t4-linear-tool-call-v1.json","run://fixture.json"],"allowed_providers":["internal-sympy-t4-linear-v1"],"max_seconds":60.0,"max_tool_calls":1,"network":"disabled","policy_id":"offline-t4-exact-linear-v1"},"providers":[{"kind":"deterministic-domain-evaluator","name":"Local SymPy exact matrix evaluator","provider_id":"internal-sympy-t4-linear-v1","source_ref":"scripts/verify_t4_linear_formal.py","version":"1.13.3"}],"run_id":"run-t4-linear-6931db19a01bc59b","seed":17,"status":"completed","task_id":"t4-optional-exact-linear-invariant-v1","tools":[{"deterministic":true,"name":"Exact rational linear-invariant proof","network_required":false,"parameter_schema_ref":"schemas/t4-linear-tool-call-v1.json","tool_id":"t4-exact-linear-invariant-v1","version":"1"}],"traces":[{"entries":[{"event_type":"run.initialized","payload_hash":"70bc8035141439803937ac09073665eb21a3cda9c172d8cfbe047b915e2ed817","seq":0},{"event_type":"policy.applied","payload_hash":"1d32a62d546a01836c2506bd7a4e7bf42e5346c5da74d4137a6897b64ec886f2","seq":1},{"event_type":"tool.invoked","payload_hash":"75b5568f6b035c4061144c6db6c5d64636933532db8e7136bb0942b6e492cd45","seq":2},{"event_type":"evaluator.completed","payload_hash":"37db195fc55c9ab263a5ac67cd6c1c3cdd7b9d3404b70e35060524cdd8e4838f","seq":3},{"event_type":"negative_case.checked","payload_hash":"c951e32c30835cc5ee00067d0181bd33aa321a07f9155db815ed781bee523bff","seq":4},{"event_type":"run.completed","payload_hash":"d0765f73cd5d1df39be353d538ea7c47a017d66a8bd001dc4707240dbb71e58c","seq":5}],"input_hash":"6931db19a01bc59b2e8ef66773e6f16c374f6785457c39f25fae01d9168ef18c","run_id":"run-t4-linear-6931db19a01bc59b","trace_id":"trace-run-t4-linear-6931db19a01bc59b"}]}
